{
  "boundaries": [
    "Integer profiles publish signs, magnitude buckets, sentinels, and frequency shapes without raw multi-byte values.",
    "Cross-capture row equality uses salted in-memory hashes; no digest or raw comparison key is published.",
    "Capture-pair products expose only public filenames and shared-row counts.",
    "Timing publishes relative buckets and frame gaps, not exact outer values or capture times.",
    "No payload, endpoint address, actor identifier, player name, session identifier, credential, or private time is published.",
    "Published sizes, offsets, float extrema, and repetition counts can narrow candidate payload reconstruction but cannot recover the omitted bytes by themselves.",
    "Chronology and capture scenarios are correlations only; they do not establish causality, policy, or semantic field names."
  ],
  "count_and_tail": {
    "count_distribution": {
      "1": 415,
      "2": 177
    },
    "inactive_nonzero_rows": 0,
    "inactive_physical_rows": 8703,
    "inactive_zero_rows": 8703,
    "nonzero_tail_samples": 0,
    "tail_samples": 592,
    "zero_tail_samples": 592
  },
  "coverage": {
    "captures": 54,
    "corpus_sha256": "1293490808399dd5e1015d921a388f0fe4931dfa3ef678f30d790f5296025e6a",
    "count_one_events": 415,
    "count_two_events": 177,
    "events": 592,
    "float_profiles": 4,
    "integer_profiles": 70,
    "logical_rows": 769,
    "record_bytes_profiled": 30760,
    "target_c2s_events": 0,
    "target_s2c_events": 592
  },
  "float_profiles": [
    {
      "bit_pattern_frequency_groups": {
        "1": 388,
        "10": 2,
        "11": 2,
        "12": 1,
        "13": 1,
        "14": 1,
        "18": 1,
        "2": 32,
        "22": 1,
        "3": 11,
        "37": 1,
        "4": 14,
        "5": 6,
        "6": 4,
        "7": 1,
        "9": 1
      },
      "distinct_bit_patterns": 467,
      "finite": 769,
      "finite_max": "1836.94482",
      "finite_min": "-1612.62634",
      "nan": 0,
      "negative_finite": 201,
      "negative_infinity": 0,
      "negative_zero": 0,
      "offset": "+0x14",
      "positive_finite": 566,
      "positive_infinity": 0,
      "positive_zero": 2,
      "samples": 769,
      "subnormal": 0,
      "valid_float32_bit_patterns": 769
    },
    {
      "bit_pattern_frequency_groups": {
        "1": 319,
        "10": 1,
        "11": 2,
        "12": 1,
        "14": 1,
        "18": 1,
        "2": 33,
        "23": 1,
        "3": 14,
        "4": 8,
        "40": 1,
        "5": 6,
        "51": 1,
        "6": 7,
        "7": 2,
        "8": 2,
        "9": 2
      },
      "distinct_bit_patterns": 402,
      "finite": 769,
      "finite_max": "149.472565",
      "finite_min": "-12",
      "nan": 0,
      "negative_finite": 23,
      "negative_infinity": 0,
      "negative_zero": 0,
      "offset": "+0x18",
      "positive_finite": 744,
      "positive_infinity": 0,
      "positive_zero": 2,
      "samples": 769,
      "subnormal": 0,
      "valid_float32_bit_patterns": 769
    },
    {
      "bit_pattern_frequency_groups": {
        "1": 389,
        "10": 2,
        "11": 2,
        "12": 1,
        "13": 1,
        "14": 1,
        "18": 1,
        "2": 33,
        "22": 1,
        "3": 10,
        "37": 1,
        "4": 14,
        "5": 6,
        "6": 4,
        "7": 1,
        "9": 1
      },
      "distinct_bit_patterns": 468,
      "finite": 769,
      "finite_max": "1741.29932",
      "finite_min": "-1927.96228",
      "nan": 0,
      "negative_finite": 645,
      "negative_infinity": 0,
      "negative_zero": 0,
      "offset": "+0x1c",
      "positive_finite": 122,
      "positive_infinity": 0,
      "positive_zero": 2,
      "samples": 769,
      "subnormal": 0,
      "valid_float32_bit_patterns": 769
    },
    {
      "bit_pattern_frequency_groups": {
        "1": 335,
        "10": 2,
        "11": 2,
        "12": 1,
        "13": 1,
        "14": 1,
        "18": 1,
        "2": 49,
        "22": 1,
        "3": 18,
        "37": 1,
        "4": 13,
        "5": 5,
        "6": 4,
        "7": 2,
        "9": 1
      },
      "distinct_bit_patterns": 437,
      "finite": 769,
      "finite_max": "3.13171029",
      "finite_min": "-3.12533283",
      "nan": 0,
      "negative_finite": 388,
      "negative_infinity": 0,
      "negative_zero": 2,
      "offset": "+0x20",
      "positive_finite": 377,
      "positive_infinity": 0,
      "positive_zero": 2,
      "samples": 769,
      "subnormal": 0,
      "valid_float32_bit_patterns": 769
    }
  ],
  "header_dword_profiles": [
    {
      "all_ones_sentinel_count": 0,
      "distinct_values": 1,
      "offset": "+0x00",
      "samples": 592,
      "signed_sign_distribution": {
        "negative": 0,
        "positive": 592,
        "zero": 0
      },
      "unsigned_magnitude_distribution": {
        "bits-21-24": 592
      },
      "value_frequency_groups": {
        "592": 1
      },
      "width": 4,
      "zero_count": 0
    },
    {
      "all_ones_sentinel_count": 0,
      "distinct_values": 1,
      "offset": "+0x04",
      "samples": 592,
      "signed_sign_distribution": {
        "negative": 592,
        "positive": 0,
        "zero": 0
      },
      "unsigned_magnitude_distribution": {
        "bits-29-32": 592
      },
      "value_frequency_groups": {
        "592": 1
      },
      "width": 4,
      "zero_count": 0
    },
    {
      "all_ones_sentinel_count": 0,
      "distinct_values": 1,
      "offset": "+0x08",
      "samples": 592,
      "signed_sign_distribution": {
        "negative": 0,
        "positive": 592,
        "zero": 0
      },
      "unsigned_magnitude_distribution": {
        "bits-13-16": 592
      },
      "value_frequency_groups": {
        "592": 1
      },
      "width": 4,
      "zero_count": 0
    }
  ],
  "hypotheses": {
    "coordinate_like_ranges": "All tested float bit patterns are finite; range alone does not establish coordinates.",
    "count_slot_behavior": "Counts one and two activate the first one or two physical rows; inactive row bytes are reported separately.",
    "key_like_stability": "Some integer and row tuples repeat, but capture repetition does not establish an identity noun.",
    "per_row_identity": "Repeated complete rows support stable observed tuples only, not entity identity.",
    "semantic_nouns": "No field noun is promoted from capture statistics or filenames."
  },
  "integer_profiles": [
    {
      "all_ones_sentinel_count": 0,
      "distinct_values": 3,
      "offset": "+0x00",
      "samples": 769,
      "signed_sign_distribution": {
        "negative": 175,
        "positive": 592,
        "zero": 2
      },
      "unsigned_magnitude_distribution": {
        "bits-05-08": 767,
        "zero": 2
      },
      "unsigned_value_distribution": {
        "0": 2,
        "211": 175,
        "65": 592
      },
      "value_frequency_groups": {
        "175": 1,
        "2": 1,
        "592": 1
      },
      "width": 1,
      "zero_count": 2
    },
    {
      "all_ones_sentinel_count": 0,
      "distinct_values": 3,
      "offset": "+0x01",
      "samples": 769,
      "signed_sign_distribution": {
        "negative": 0,
        "positive": 767,
        "zero": 2
      },
      "unsigned_magnitude_distribution": {
        "bits-05-08": 767,
        "zero": 2
      },
      "unsigned_value_distribution": {
        "0": 2,
        "39": 175,
        "41": 592
      },
      "value_frequency_groups": {
        "175": 1,
        "2": 1,
        "592": 1
      },
      "width": 1,
      "zero_count": 2
    },
    {
      "all_ones_sentinel_count": 0,
      "distinct_values": 2,
      "offset": "+0x02",
      "samples": 769,
      "signed_sign_distribution": {
        "negative": 767,
        "positive": 0,
        "zero": 2
      },
      "unsigned_magnitude_distribution": {
        "bits-05-08": 767,
        "zero": 2
      },
      "unsigned_value_distribution": {
        "0": 2,
        "155": 767
      },
      "value_frequency_groups": {
        "2": 1,
        "767": 1
      },
      "width": 1,
      "zero_count": 2
    },
    {
      "all_ones_sentinel_count": 0,
      "distinct_values": 2,
      "offset": "+0x03",
      "samples": 769,
      "signed_sign_distribution": {
        "negative": 0,
        "positive": 767,
        "zero": 2
      },
      "unsigned_magnitude_distribution": {
        "bits-01-04": 767,
        "zero": 2
      },
      "unsigned_value_distribution": {
        "0": 2,
        "2": 767
      },
      "value_frequency_groups": {
        "2": 1,
        "767": 1
      },
      "width": 1,
      "zero_count": 2
    },
    {
      "all_ones_sentinel_count": 0,
      "distinct_values": 1,
      "offset": "+0x04",
      "samples": 769,
      "signed_sign_distribution": {
        "negative": 0,
        "positive": 0,
        "zero": 769
      },
      "unsigned_magnitude_distribution": {
        "zero": 769
      },
      "unsigned_value_distribution": {
        "0": 769
      },
      "value_frequency_groups": {
        "769": 1
      },
      "width": 1,
      "zero_count": 769
    },
    {
      "all_ones_sentinel_count": 0,
      "distinct_values": 1,
      "offset": "+0x05",
      "samples": 769,
      "signed_sign_distribution": {
        "negative": 0,
        "positive": 0,
        "zero": 769
      },
      "unsigned_magnitude_distribution": {
        "zero": 769
      },
      "unsigned_value_distribution": {
        "0": 769
      },
      "value_frequency_groups": {
        "769": 1
      },
      "width": 1,
      "zero_count": 769
    },
    {
      "all_ones_sentinel_count": 0,
      "distinct_values": 1,
      "offset": "+0x06",
      "samples": 769,
      "signed_sign_distribution": {
        "negative": 0,
        "positive": 0,
        "zero": 769
      },
      "unsigned_magnitude_distribution": {
        "zero": 769
      },
      "unsigned_value_distribution": {
        "0": 769
      },
      "value_frequency_groups": {